	pid	text	explanation	target_of_sarcasm
0	931874353976938497	'check out the pulse pounding excitement of # paxunplugged of waiting in line <num> hours before game sign up begins . waiting in line , what a gaming convention is all about . '	the people are bored of waiting in line <num> hours before game sign up begins.	waiting in line 
1	880425829246922752	'proud to have a <user> who attacks private citizens via twitter instead of doing hard work on health care , nat sec the job requires '	it's sad to have a <user> who attacks private citizens via twitter instead of doing hard work on health care, nat sec the job requires.	<user> for attacking citizens via twitter
2	690915881082343424	'the view from my house ........ yay  # pasnow # blizzard2016'	the author has a terrible view of everything covered with snow from his house.	blizzard
3	915228456757059585	'these # colombo # jaffna # vavuniya luxury busses are very high tech  # cultureshock # turkishairlines'	these # colombo # jaffna # vavuniya luxury busses aren't very high tech.	technology in vavuniya luxury busses
4	494194068998468686_25639236	Thanks North Carolina, I was worried we weren't gonna hit traffic	the author was worried that they were gonna hit traffic in North Carolina and it turned out to be true.	traffic in north carolina
5	847004394612776965	'junk mail : free viagra . stripper wants to meet me . and , someone will send me 100k if i give them my account number . score ! # japan '	the author is annoyed with such junk mail.	junk mail
6	886345583052681217	'god awful venue . terrible view . '	it's a beautiful venue and lovely view.	beautiful view of venue
7	852753018558623745	'kids : - take selfie from mobiles adults : - take selfie from dslr legends : - take selfie from landline # amitabhbachchan # trending '	one can't take a selfie from a landline.	taking selfie from landline
8	879809878113603586	i hope england isn 't too rainy , or anything ...  emoji_131 emoji_15	england is too rainy.	england's rainy weather
9	884143989342916609	"'your persistence has paid off , i am "" woke "" , the earth is flat ! ! ! '"	their persistence hasn't paid off, the author doesn't believe that the earth is flat.	post saying earth is flat
10	806951240773025792	'so helpful at building the puzzle .  # illjustdoitalone # frozen # littlehelpers # toddlers'	these toddlers aren't helpful at building the puzzle.	toddlers help at building the puzzle
11	709046988462014464	'moving is so much fun  # intended'	moving is exhausting and not fun.	difficulty in moving
12	693187562681143296	i can 't believe this . i was so sure she was always honest and trustworthy 	the author expected this since she wasn't sure that clinton was always honest and trustworthy.	honesty and trusworthiness of clinton
13	865338439633260544	'some people have no concept of common sense . great priorities though !  # wwyptoti # facepalmfriday <user>'	it's a wrong priority to status update than to call police when someone is trying to break in.	person updating status while robbery
14	882284909083185153	'hey <user> thanks for making it easy for me to take my music with me .  # ihateyourupdates'	the author hates <user>'s updates since they make it difficult for her to take her music with her.	<user>'s updates
15	713905030516985856	'such a big turn out in a state of 7million wowzy 16000 people will surely get him elected '	in a state of 7 million, 16000 people is a very low turn out.	low turn out for election
16	691712999518773248	'sport is good for you they say ... # pe # soccer # tackle # knee '	the author has injured his leg playing sports.	author's injury
17	852193638641741828	it 's such a shame it 's a terrible day . maybe when it 's beautiful out my driveway will get fixed  # cityofjonesboro # thanksyall emoji_156	it's a beautiful day and still the author's driveway isn't getting fixed.	author's driveway not being fixed
18	689033889923219456	'our very own einstein ...  # indiancongress'	he said steve jobs' of microsoft instead of apple, he isn't very bright.	rahul gandhi's intelligence
19	910531588118560768	'new # airteldsl technology upgrade package provided 810gb for <num> months <user> for being a loyal customer for all these years . '	it's sad that airteldsl technology upgrade package provided just 810gb for <num> months even after being a loyal customer for all these years.	airteldsl technology's upgrade package providing less data
20	874428307001008134	"'aww  this is so romantic ! what a great way to start off a "" modern fairytale "" ! '"	"this isn't so romantic, it's a terrible way to start off a ""modern fairytale""."	man's sexist comments
21	847570526302334976	'hats off to the american <user> for highlighting the weather in the metropolis of cape st . george ! # nlwx '	there's no need for the american <user> to highlight the weather in the metropolis of cape st. george.	<user> highlighting the weather in metropolis of cape st george
22	822097672622444544	<user> nice job guys ! can 't wait to open my package and reassemble my glass . # thanksfortheglasspuzzle 	the author is pissed at <user> for such a package with broken glass.	<user>'s bad delivery
23	731266833140056065	'this would look fantastic in the program book i think . shows a lot of depth and substance . '	this would definitely not look good in the program book, does not have any depth or substance	sentence not having depth or substance
24	820837997609617466_352689	So excited to be back #soton #renalphysiology	the author isn't excited to be back for renal physiology.	author's excitement for renal physiology
25	854870849802784768	yup . that 's a 15inch receipt for a 6pk of eggs . <user> doing their part for the environment  # keeptahoeblue # allthepaper	<user> isn't doing their part for the environment since they are wasting paper by giving a 15inch receipt for a 6pk of eggs.	<user> for wasting paper
26	706246124890357761	'reminder : this looks like a legitimate email , really must reply ;-)  # phishing'	This is a phishing email, one must not reply to it	phishing email
27	831377442250055680	'<user> real quality product  # areyouserious emoji_60'	this is a terrible quality product from <user>	quality of the product
28	589208922845607906_209903324	Oh I just #love having to stare at this while I #work. #iwanttogo #disneyland #disney #anaheim	the author wants to go to the disneyland and not just stare at it while working.	author wanting to go to disneyland
29	696505904536162304	'thanks <user> for slipping a # millerlite into our case of the # silverbullets really '	the author is pissed at <user> for slipping a millerlite into their case of the silverbullets.	<user> slipping a millerlite into the case of the silverbullets
30	833203062269472768	'what i plan on saying to anyone that rings my doorbell . # ahs # americanhorrorstory # quote  # itsfunnydammit'	this isn't how one treats another human being let alone anyone that rings one's doorbell.	harsh words in the quote
31	826055705689980929	'this is why i wanted to be a mom ... # bouncebackwoman '	this isn't why i wanted to be a mom, i didn't want to become the maid of the house.	mom being the maid of the house
32	867720903291011075	'you just have to love the intelligent & cogent discourse on current geo-political events that happens on twitter . '	the author hates the stupid & unconvincing discourse on current geo-political events that happens on twitter.	quality of discourse on twitter
33	917218254262857728	'comp went great  # overwatch'	comp didn't go great, given the score.	low score
34	707214690200514561	don 't you just love sunny # italy ? ha 	the author hates the rainy italy.	rainy weather in italy
35	903489017450082305	'who could say no to that kind of email subscription ? '	nobody could say yes to that kind of spam email subscription.	spam email subscription
36	904371378203361282	'took this <user> .. dhs using r tax $ s wisely . '	dhs isn't using the tax $s wisely.	dhs wasting tax money
37	897656552034889728	<user> i found this article about dad . i 'm sure it 's fake . 	the author found this article about dad that isn't fake.	authenticity of article about dad
38	910907108056616960	'super crazy busy day at work today '	the author didn't have a busy day at work today, given he's playing guitar.	author playing guitar
39	922928946601250816	whoa , so much diversity here i don 't know where to start ! 	there's not much diversity in these dolls.	diversity in the dolls
40	865644609065459712	'such a shame to see the # cubs lineup struggling .  # mlb'	the author's glad to see cubs lineup not struggling, they have good average.	good average of cubs
41	709478808466796544	bonnie is so well behaved at the vet 's office 	bonnie doesn't seem well behaved at the vet's office.	bonnie's behaviour at vet's office
42	932590914563911682	'why are # schools not cancelled ? ! ? # snow everywhere !  <user> <user> <user> # weather emoji_543'	schools shouldn't be cancelled since there's not much snow.	small amount of snow
43	864590999628259329	it 's not bad for you , it 's just water that smells and taste bad . i don 't know what people are upset about . 	water that smells and taste bad isn't safe to drink, it's obvious what people are upset about.	bad taste and smell of the water
44	904047137742131200	'yay ! people with little playing time vs people with a lot of playing time <user> # fair  emoji_75'	the author isn't excited since people with little playing time vs people with a lot of playing time is unfair.	difference in playing time between the two teams
45	695408460888846336	'what wonderful news .  # howisthisallowed # hs2 <user> <user> <user>'	63 ancient woods under threat aren't wonderful news.	63 ancient woods under threat
46	869193679331880960	'busy day for the t . # memorialday # memorialdayweekend # mbta # thet # parkinglot # empty '	not a busy day for the t, the parking lot is empty.	empty parking lot
47	729749047196651521	we all know someone who 's a great speller  # itsatragedy # facepalm	we all know someone who's not a great speller.	person who is not a good speller
48	614218461820239484_272164622	The wonderful sounds I wake up to at 8 am on my birthday. #notimpressed #gobacktobed #noisepollution #ugh	the author woke up to some disturbing noises at 8 am on his birthday.	sounds waking up the author
49	883368108509065216	'behold ! ! ! my huge profit of tenx pay token $ pay ! lol  $ ecc $ anc $ sc $ eth $ rdd $ nxt $ rdd $ dgb $ xvg $ btc $ ltc'	the author made almost no profit of tenx pay token.	no profit of tenx pay token
50	817895995551817728	'this stormpocalypse is incredible . look at the destruction . '	this stormpocalypse doesn't seem serious, there's no destruction.	no destruction from stormpocalypse
51	874309775277903873	'my current 100mbps fibre line . so erratic . thanks <user> and <user>  . wtf am i paying for'	the author is pissed at <user> for such terrible speed with 100mbps fibre line.	<user>'s low speed
52	867492173192847361	<user> thank you so much for helping the <user> hurt people . you 're quite the fella . 	the author is pissed at <user> for helping the <user> hurt people.	<user> for helping <user> hurt people
53	909090584681467904	'splat parties are so much fun . please do more of them .  # splatoon2 # splatnet2'	the author doesn't enjoy splat parties.	author's enjoyment for splat parties
54	834068686994546691	'gotta love microsoft surface . '	the author hates microsoft surface since it keeps running into such problems.	problem in microsoft surface
55	919651889511313408	'leaving <num> degrees barcelona to come home for # opheliahurricane # yay  emoji_2306 emoji_2748 emoji_4941 emoji_2230 emoji_2306 emoji_2748 emoji_4941'	the author's not excited for leaving <num> degrees barcelona to come home for ophelia hurricane.	going to home while ophelia hurricane
56	946327527893475810_36699327	Another day in paradise #winteriskillingme	the author isn't enjoying the chilling winter.	winter
57	725827703518044160	'ooo please dont block me , i may not be able to sleep tonight ! '	the author doesn't care if got blocked.	person warning the author of being blocked
58	711350328222830596	'glad the warriors game is on abc ... thanks <user> for this instead of basketball  # fixitquick'	the author is pissed at <user> for missing the warriors game on abc due to the lack of service.	<user>'s bad service
59	887498868031504384	'wow <user> how do you offer these prices  seriously 54.95 vs 55 ! ? !'	it's not a good offer since there's not much difference in prices 54.95 vs 55.	<user>'s low discount
60	869058614928920576	making a lesson on movement prepositions ... here 's an example of my fantastic artwork ... on paint  ..	this is an example of the author's trivial artwork on paint.	quality of author's artwork
61	918882479066550273	'looks flat to me .... # flatearth  # imnotadumbass'	the author doesn't think the earth is flat.	people who say earth is flat
62	922817427523751936	'potus <user> is making progress ...... '	potus <user> didn't make progress.	potus <user>'s leadership
63	684633048483106816	dad 's handy work . can 't tell at all . 	one can easily tell from the patches that it's dad's handy work.	obvious handy work of the author's dad
64	915572031348989952	<user> throws paper towels at people of # peurtorico . he 's trying to help ?  # trumppuertorico try # bounty next time	<user> throwing paper towels at people of peurtorico doesn't show that he's trying to help.	<user> throwing paper towels at people of peurtorico
65	696781402143092736	'thank you <user> for fixing my # overheating # issue on the # lg # g4 with a brand new # battery . '	the author is pissed at <user> for not fixing her overheating issue.	<user>'s bad service
66	1004238846589291391_1972821681	It's always best to introduce your new spouse as your first husband/wife. Just to be clear ð (available in our Etsy store, link in the bio)#thetruthhurts #wedding #marriage #engagement #engaged #married #justmarried #firsthusband #firstwife #husband #wife #keepitreal #greetingcard #greetingcards #funny #sarcastic #etsy #buyme #ð#ð° #weddings #marry	It's not socially acceptable to introduce your new spouse as your first husband/wife.	introducing new spouse as as your first husband/wife
67	870411295366971393	yo <user> thanks for the yearly fee reminder ! here 's to you !  tweet # planetfitness # hiddenfee # mrmet	the author doesn't need <user>'s yearly fee reminder.	<user>'s yearly fee reminder
68	901363283814469632	there 's a shocker  mother nature throwing us a curveball on 1st day of stroke play .  # ussenioram	there's no shocker, mother nature is doing what was pretty much expected.	mother nature being unpredictable
69	849290990644887552	'the overwhelming simplicity of health insurance categories in the us .  # natcon17'	the complexity of health insurance categories in the us is overwhelming.	complexity of health insurance categories in the us
70	925726876571541504	i 'm so happy to be here . 	the author isn't happy to be working in such snow.	working in snowy weather
71	850203662043316225	'gotta love <user> '	the author hates <user> for his stupid views.	stupidity of <user>'s views
72	817140515699298304	this day can 't get any better ( or can it )  emoji_619 emoji_619	the author is sad to have got blocked from following easynow.	being blocked from following easynow
73	934693707714125824	'what a joy to wake up the morning after thanksgiving dinner at the hatch flat ! ! '	it's not a joy to wake up the morning after thanksgiving dinner at the hatch flat to all these dirty dishes.	cleaning dirty dishes 
74	891528208620728320	'thanks to # altadenadairy for parking their trucks across a # handicap spot and four regular ones ! # veryconsiderate  # parking'	it's inconsiderate of altadenadairy, parking their trucks across a handicap spot and four regular ones.	parking in a handicap spot
75	724782785961938944	'my cat completely busting a potted plant on the floor at 9:30 pm is exactly how i wanted to spend my night . '	the author's cat completely busting a potted plant on the floor at 9:30 pm isn't exactly how she wanted to spend her night.	cat busting a potted plant
76	717489132436643840	'great to see how <user> is still boycotting # apple and therefore shows people can trust his words '	<user> is boycotting apple but is using iphone at the same time, people can't trust his words.	<user>'s hypocrisy
77	760955682600569097_507243633	Got some really exciting reading material in the kitchen at work! #killme	the author got some really boring reading material in the kitchen at work.	author's excitement for the reading material
78	1034193762464755130_1449452234	You were gonna do it anyway! Tag a friend who always does this! @rebelcircus #rebelcircus #meme #bitchyquotes #funny #bitchy #funnyquotes #sarcasm #sarcastic #drama	when you're upset, posting more to facebook doesn't eliminate any drama.	posting in facebook while being upset
79	724595120419540993	'i take such amazing pics , like this one , the back of john force .  # closeenough emoji_113'	the author doesn't take amazing pics, this one has back of a person.	quality of author's pics
80	840942465544781826	'wow . really looking forward to this week .  emoji_509 emoji_92'	the author isn't looking forward to such a week with bad weather.	weather
81	850107114337038341	'<user> - fil-a thanks for the large fry  # therearenofries # 25 % full'	the author is pissed at <user> for such small quantity of fries.	less number of fries
82	918237307169378305	'<user> delighting me w / fees . great way to waste $ on my travels when no wells atm is avail . great tx of ur long-time clients '	the author isn't happy to pay $ 5 as atm transaction fee.	atm transaction fee
83	1009382386362605022_207907934	Love you guys ððððð #great #funny #sarcasm #lol #justsaying #oneofthosedays #whysoserious #instamood #bitchplease #sarcastic #haha #dontbesoserious #humor #comeback	nobody likes controversial, obscene, dirty, offensive, derogatory posts and those who posts them.	person who posts controversial and obscene posts
84	933348137229520899	'school time yaaaaayy '	the author isn't excited for school time.	author's excitement for school
85	918429979553206272	'well today ΓÇÖ s gonna be just wonderful '	today's not gonna be wonderful with such cloudy weather.	cloudy weather
86	926205043078062080	'my girl , <user> , is obviously lazy and never does anything  <user> emoji_131'	the author's girl isn't lazy.	schools needing large money for improvement
87	826424841511264258	'<user> this what i get for 300/100 internet ? your gigabit must he so awesome .  # wastingmymoney # losingthebattle'	the author is pissed at <user> for getting such terrible speeds for 300/100 internet.	<user>'s low speed
88	841783464969961472	here 's a typical conversation between my mom and i . . she is so modest ! ! !  emoji_15 emoji_15	the author's mom isn't modest given she said she looks gorgeous.	conversation between mom and author
89	888771490782556162	'<user> yeah cause the whole black lives matter thing got absolutely no attention .  # cnniscancer'	the whole black lives matter thing did get attention.	cnn's biased news
90	894840189473783808	'<user> what is this bullcrap . now i have to go back to the store . # goodjob '	the author is pissed at <user> since the food has already gone bad and he has to go back to the store.	<user> for quality of food
91	1023294368457853313_1932406441	The greatest place on earth, the Clovis DMV! #sarcastic	usually people don't like being at a DMV.	being at a dmv
92	891141606614716416	little goofer lost a toofer today . she 's not excited about it at all .  she 's already in bed waiting on the # toothfairy .	she's excited about losing a tooth today.	little kid's excitement for the toothfairy
93	923298711840501760	i don 't think there 's enough media there , guys 	there's enough media there.	number of media persons
94	939124019009327105	'marine life comes in a dazzling array of colours , if what i encountered during a short stroll in a tidal pool is anything to go by . '	this isn't marine life, a short stroll in a tidal pool is nothing to go by.	lots of trash in the tidal pool
95	921038238458015744	'it must had really hurt <user> not to be able to serve his country that he loves so much ...  # fakepresident'	it must not had hurt <user> not to be able to serve his country, looking at how indifferent he is about it.	<user>'s dedication for the country
96	876961690256121857	wow , a whole 130kbps ? how am i so fortunate to only pay $ 110 / mo for such speeds ? it 's like <user> is just giving it away ! 	the author pays $ 110 / mo for a speed better than 130kbps.	<user>'s low speed
97	1011130478024998004_1728949110	What did you think I would be doing in the middle of the day on a Thursday? Fucking genius. ..#tinder #tinderfail #creepyguy #creepytindermoments #loser #youscaredmeoff #pickuplines #pickuplinesthatdontwork #hi #snarky #sarcastic #snarkastic #youarestupid #stupid #stupidity #stupidityiswinningthewar #no #idiot #byefelipe	asking what one is doing in the middle of the day on a Thursday is stupid since one would be working.	stupidity of person's message
98	731450474767994880	'great day for desert training  <user> <user> <user> <user> <user>'	this is not a great day for desert training, it's rainy.	rainy weather
99	895033580983799808	'awwwww . sometimes our viewers are so sweet ;) '	sometimes their viewers aren't so sweet, posting such hate comments.	viewers hate comments
100	702202941764030464	it 's too bad this place isn 't picturesque !  # postitnotesandwalkietalkies # pillowtalk # travel <user>	this place is very picturesque.	place being picturesque
101	918307803709788160	'<user> ok , so , really , you will give me <num> miles if i spend $ 24,500 between now and end of the year ?  i must be # rich'	the author would have to be rich to spend $ 24,500 for <num> miles.	spending $24,500 for <num> miles
102	927153423887282176	'nothing makes concrete architecture look better than a slick of rain .  # hamont # latergram # orwhateverthetermisontwitter # brutalism'	a slick of rain doesn't make concrete architecture look better.	effect of slick of rain on concrete architecture
103	687339807463337985	i felt so safe eating lunch today ! i 'm sure this sign kept all the bad guys out ! 	just banning guns doesn't ensure safety from all the bad guys out.	effect of banning guns on bad guys
104	838409460800442370	hmmm , i can 't tell what kind of truck this is ? maybe a f - 150 ?  emoji_1781	everyone can tell what kind of truck this is, RAM is written in big letters.	name of car written big in the back
105	839856340755496960	toronto women 's fashion week bound ! i don 't think i packed enough .  <user> <user> <user> <user>	the author overpacked for toronto women's fashion week.	author being overpacked
106	909115051566555136	'love that 4:6 coach ratio !  <user>'	the author doesn't like the uneven 4:6 coach ratio.	uneven coach ratio
107	910160324288016385	'killing millions of innocent civilians who are already victims of a tyrannical regime , yes , that ΓÇÖ s the answer . '	killing millions of innocent civilians who are already victims of a tyrannical regime isn't the answer.	trump's leadership
108	878996294735364096	well that 's good ... i wasn 't sure if i could go another 24hrs without rain . was getting dry .... enough to cut grass lol  cool sky	the author doesn't want rain, it's bad that it's cloudy.	rainy weather
109	847560514020552704	'i love talking about wind chill in late march . '	the author hates talking about wind chill in late march.	wind chill in late march
110	716406596402880512	'without electricity , awesome ! ! - _ - # nolights # no # electricity # poweroff # awesome # super  # dammit'	without electricity it's inconvenient.	no electricity
111	993855515454763966_2115248995	Love how thick a short sale file gets....	the author hates how thick a short sale file gets.	thickness of a sale file
112	854649659612261994_17016594	Coldest day of the year, I'm jumping in mud holes. #swampdiving #commercialdiving	the author hates his job since it's coldest day of the year and he's jumping in mud holes.	jumping in mud holes in coldest day of the year
113	882973218281095168	'flight delays are the best . # rtxaustin '	flight delays are the worst.	flight delays
114	853633927130624001	'and on the third day , god created the remington-bolt action rifle . so man could fight the dinosaurs . and the homosexuals . # meangirls '	god hadn't created remington-bolt action rifle and nor had he meant for man to fight the homosexuals.	people who are homophobic
115	700095443729018880	'loving our new <user> sit / stand furniture . '	the author doesn't like their new sit/stand furniture, it's not of good quality.	quality of new <user> sit/stand furniture
116	850395934857056256	'guy with t * ump sticker in front of a sprint store . this is a man who obviously knows how to make good decisions . '	a guy with a trump sticker obviously doesn't know how to make good decisions.	guy for putting a trump sticker
117	730666246128046080	'honestly , dillon takes awesome pictures of me . '	dillon doesn't take awesome pictures of the author.	quality of dillon's picture
118	875641072193425408	'thanks <user> and <user> for this amazing service that i pay for .  # cancelplease'	the author doesn't pay for such awful service.	<user>'s bad service
119	879989029609123842	"'great job  <user> . "" don \'t bother with education  just be pretty . "" great ad message  # 1950s'"	"it's a stupid ad message ""don't bother with education just be pretty""."	ad message
120	697979343704817667	'nothing better than a screeching fire alarm at 10p in your hotel . '	the author is annoyed with a screeching fire alarm at 10p in her hotel.	sound of the fire alarm
