	pid	text	explanation	target_of_sarcasm
2261	916768558255886336	'american girl showed incredible originality w / this one : white girl who sings country . go diversity ! '	american girl didn't show originality w/ this one: white girl who sings country, no diversity.	diversity in the doll
2262	822053378649780227	'oh  this is a totally fair move that really shows that the government is doing it right !  # batoresign ( article credit : <user> )'	the government treating the rich and poor differently in such a way is unfair.	government's treatment of poor
2263	855209255753961472	'these ghost employees at <user> here in gaithersburg , md are wonderful . excellent customer service ... |  # anyonehome ?'	the author didn't get a good customer service at <user> in gaithersburg, md.	<user>'s bad customer service
2264	822100558282526721	the top 10 % of economy is so generous at least they saved us some financial assets , there 's no inequality here  # 99to1 # 33740w17	the top 10% of economy isn't generous, it's inequality.	top 10% of economy
2265	927554282177662977	'oh thank you now i understand everything ... '	this is a poor translation, the author doesn't understand everything.	poor transalation
2266	1026088741867945461_2130221086	Dickhead fairy lol #instalike #instaweed #instafollow #instafunny #igers #igersoftheday #weedstagram #weed #420 #highsociety #highlife #lol #laughalittle #like4like #l4l #likeforlike #l4l #fashion #followplease #followmeplease #follow4follow #f4f #f4follow #insults #insultagram #sorrynotsorry #sarcasm #sarcastic #snarkecards	it's not one's fault if someone acts like a total jerk.	person acting like a jerk
2267	816854550061588482	'yeah thanks for the first non-delivery card <user> . '	the author is pissed at <user> for the first non-delivery card.	<user> for first non delivery card
2268	715947738416816130	it 's pouring down rain here in nn ; like it 's been all day . good job nailing your forecast <user> 	the author is pissed at <user> for such inaccurate forecast because there's no rain in nn.	<user>'s inaccurate forecast
2269	862865692747591680	'<user> <user> eat your heart out fiber internet ! aging infrastructure is the way to go !  # dslin2017'	this is a terrible fiber internet, aging infrastructure isn't the way to go.	<user>'s fiber internet's speed
2270	879896397243445249	it 's a shame this child doesn 't have any personality !  # babygirl	this child does have a personality.	personality of the child
2271	902308807140892678	can 't believe <user> and <user> could only manage 65 's . can u boys even play ?  # respect # thisplaceistough # golf ΓÇô at shinnecock hills golf club emoji_15 emoji_92 emoji_193	<user> and <user> play well since they could manage 65's.	place which was tough for golf
2272	918808644279562241	'<user> thanks for the debris pickup , but next time leave the grass . outstanding job being done by your contractors .  # wtf'	the author is pissed at <user> for destroying some grass during the debris pickup.	<user> 
2273	874370748629925889	here 's a keeper ... # funnymemes  # relationships	she is a crazy lady causing something out of nothing.	lady doubting the man
2274	1098669932568699029_16947615	No one told me talented artists were living in my block of flats.	doodling on walls doesn't make one a talented artist.	talent of the artist
2275	810174910312120321	'hey <user> , thx for using soft packs for my christmas gifts . i hope you saved some money with your poor packing skills . '	the author is pissed at <user> for using soft cheap packs for her christmas gifts for packaging.	<user>'s packing skills
2276	725960147957227521	'got to love <user> being the fastest uk network ΓÇª '	the author is pissed at <user> for such terrible internet speeds.	<user>'s slow internet speed
2277	725580568688246784	'i live interesting life , right ? ! # timehop '	the author doesn't live an interesting life, there are no activities to be found.	no activities of the author
2278	716977528288587776	'what a great start to the week ... worst thing to happen to a radio announcer ... <user> # sad # monday '	what a terrible start to the week, the author's headphones broke which is the worst thing to happen to a radio announcer.	author's broken headphone
2279	846085226056994816	'yupp . look at those goats and also teach lions and tigers to survive on cow milk .  # hashtagbecauseidiots'	it's ok for lions and tigers to survive on goats and buffaloes, it's a food chain.	people who oppose non vegeteration
2280	819543361912770560	'the hearing for ben carson starts today for his vision for the future of hud ... just look at his great logic and reasoning ! '	ben carson's logic and reasoning is terrible.	ben carson's logic and reasoning
2281	696480192651333632	'sure glad i have my <user> notifications turned on , i might have forgot about this !   # sb50'	the author doesn't need CNN notifications to remember about the super bowl.	notifications reminding super bowl
2282	940264212441567234	'well , that told me . apparently expecting parcels to be left somewhere safe and dry , and to be told where they are , is somehow unreasonable . i apologise to <user> for my high expectations .  <user>'	expecting parcels to be left somewhere safe and dry, and to be told where they are, isn't unreasonable or high expectation.	<user>'s bad service
2283	888217149080125440	wow ... the power is out and it 's raining / thundering . but i wouldn 't have known without this weather watch # atleastmakeitawarning  emoji_156 emoji_156	the power is out and it's raining/thundering so the author would have known without this weather watch also.	weather watch
2284	869360401661743105	'what has our world come to where a video about creating a over your face for ig has 1,017 , 443 views . # smh # thefutureisbright  emoji_3400'	a video about creating a rainbow over your face for ig has 1,017,443 views, the future isn't bright.	large number of views
2285	890227220492374016	obviously i look amazing when i wake up  - - i 've had this boston patriots shirt for <num> years ! can 't toss it .	people don't look amazing when they have just woken up.	boston patriots shirt
2286	867544867689443328	'but what does this really say about the # soccer fan community ? ! # toxicsoccer '	this really says something bad about the soccer fan community.	soccer fan community
2287	829354083253379073	'yes rihanna , the lyrics to this song are so deep . '	the lyrics to this song aren't deep.	lyrics of the song
2288	723702052988162048	'thanks for the wonderful ride <user> # pedalinstallfail  # ruinedevening'	the author is pissed at <user> for such awful ride with no pedal, it's uncomfortable.	<user>'s ride with no pedal
2289	717435878512025600	'prenatal education . how can you expect anything of a child who missed getting in-womb audio lessons ? '	prenatal education is ridiculous, a child missing in-womb audio lessons can still be expected to perform well in real life.	prenatal education
2290	936944562995650561	'my football crew ! the are so excited  # theyarentexcited # mydogisintheresomewhere # myplmorning # nbcsportssoccer # plonnbc plinusa'	they aren't excited for football.	excitement of football crew
2291	894358014559305728	'breaking news : when researching obama photoshopped you get proof that obama was a drag queen '	not a proof that obama was a drag queen.	obama being a drag queen
2292	854318610415800320	no one 's going to call me a quitter ! # cantstopwontstop # neverquit # haiku # meme # funny # lol # relationshipgoals 	you aren't a quitter if you quit fighting.	fighting between couples
2293	915889618435715072	'perfect . because it was getting a little dry around here . '	the author is sad due to such rainy weather, it wasn't getting dry around there.	rainy weather
2294	915212299891363840	'this briefing pack for us scholars from <user> on quirks of british office culture is amazing . # tea  # pub'	this briefing pack for us scholars from <user> on quirks of british office culture is not amazing.	<user>'s briefing pack for us scholars
2295	912696491692654593	right ! burn the flag instead , it 's more respectful . 	burning the flag isn't respectful.	burning the flag
2296	704860274667302912	'i really hate color blue ! yeah i hate it ! lol  emoji_40 emoji_53'	the author loves color blue, she's got blue clothes and a blue purse.	author dressed in blue color
2297	319567300611692732_217569757	Mmmm. What a delicious bologna and bread sandwich! #boring	the author finds the bologna and bread sandwich boring.	bologna and bread sandwich
2298	1013584543248736549_13232743	Whatever could this key be for? #mystery #key #whoknows #neverknow #sarcastic #blatant #foundit	it's obvious what this key is for since it has 'dance studio key' written in big letters.	obvious use of key
2299	932795129655463938	super glad for all those rich folks getting tax deductions on private schools they can pay for out of pocket . definitely fair that poor people borrowing money to pay for college don 't get any deductions . 	it's unfair that all those rich folks get tax deductions on private schools they can pay for out of pocket but poor people borrowing money to pay for college don't get any deductions.	rich folks getting tax deductions
2300	708552930547396608	'mmmm delicious - easily confused with the real <user> obviously '	the food is tasteless and is not at all comparable with the real Southern Fried Chicken.	food in the restaurant
2301	1030940657078964075_23263266	#joke#sarcasm#sarcastic#humour #laugh#wtf#funny#lol#wtf#lmao#hilarious#life#memes#quotes#smile#willpower#exercise#gym#fitness#diet	one with an incredible will power would be exercising right now.	author's will power
2302	939083875715899393	breaking news : the pope just changed the lord 's prayer : # satire  # atheism # atheist # catholic	the pope didn't change the lord's prayer.	person's athiest post
2303	819061396025421827	'my rack is dirty ... '	the author's rack is clean.	author's clean rack
2304	910577574509551617	gee pharaoh sure doesn 't like being at grandpa 's does he ?  # imjoking ! ! ! emoji_131	pharaoh sure does like being at grandpa's, given how comfortably he's sleeping.	sleeping pharaoh
2305	916496521406726145	'i love waiting <num> min for a cab - such shortage .......  <user> please allow uber . this is insane . emoji_689 emoji_156 emoji_156 emoji_156'	the author hates waiting <num> min for a cab.	wait for the cab
2306	861692155995107328	well done <user> . journalism at it 's best .  .	saying it's emmanuel macron's wife people wanted to see is journalism at its worst from <user>.	<user>'s bad journalism
2307	815751226033836032	can 't wait for the next <num> years  emoji_156 emoji_156 emoji_156 emoji_156	with such personality of trump, the author isn't excited for the next <num> years.	trump's upcoming presidency
2308	825809320801603584	with all that 's going on but the world , good to see britain has its news priorities right ... 	with all that's going on in this world right now, it's terrible to see britain has illogical news priorities about pregnant cheryl.	britain's news priorities
2309	494179729114693143_453451310	Perfect Weather for Fair Weak#Rainy#LikeEnglandupinhere	rainy weather isn't a perfect weather for fair.	rainy weather
2310	697021286783021056	a battery charger that doesn 't indicate charge level ? real useful <user> 	it's inconvenient to have a battery charger that doesn't indicate charge level.	battery charger not indicating charge level
2311	854163234810712064	'wow , this question is so hard . i have no idea what the answer is at all . not one bit # persona5 '	this question is easy and the author knows what the answer is.	difficulty of the question
2312	696313514227539968	'thanks <user> for this delicious and appetising scrambled eggs on toast . '	the author is pissed at <user> for such tasteless and unappetising scrambled eggs on toast.	taste of scrambled eggs on toast
2313	910860301846831104	'marriage is between for procreation ? so couples who choose not to procreate would that marriage be legally invalid # voteyes  emoji_4089 emoji_4091'	marriage isn't just for procreation, so couples who choose not to procreate that marriage won't be legally invalid.	people who say marriage is just for procreation
2314	863138227250749441	'great to see the drunk <user> fans back supporting their team this year '	awful to see a drunk <user> fan public urinating.	drunk <user> fan's public urination
2315	829771850620215297	yay ! south africa made international news again ... well done to the leaders of our country . why can 't we just have order ? # sona2017 	the author is sad that south africa made international news again due to lack of order, bad job by the leaders of the country.	leaders of south africa
2316	845540831956287489	'classy people in coach ... impressed people in coach ...  # pisspoor cool'	people in coach aren't classy, the guy has his feet up.	behaviour of people in coach
2317	888016965608112130	'way to go <user> wish every country had a great president like this one . '	the author wouldn't wish any country to have a president like trump who doesn't do any substantial work.	trump's presidency
2318	923738880276357120	'this never changes or gets old ! ! # ivoteddemocratbecause '	these aren't the reasons why the author voted democratic.	reasons for author's vote for democrat
2319	872955319688847365	"'next up is <user> talking about killing off job descriptions ! "" we have so much freedom at work ""  # disrupthrto'"	we don't have much freedom at work.	freedom at work
2320	846620710948634624	'this is media who is doing alot for informing us the truth ...... jago grahak jago  emoji_15'	this is media who is bias and isn't informing us the truth.	media's biasness
2321	819706983653572609	'how original '	this logo doesn't seem original.	originality of logo
2322	900767197982838787	more proof that <user> 's base is abandoning him 	more proof that <user>'s base isn't abandoning him.	huge <user>'s base
2323	932995346787168258	'rules are made to be broken  # funny'	rules aren't made to be broken.	breaking library rules
2324	832491860954210304	'yeah , we make you look stupid . you have no part in it . '	there isn't any liberal plot that makes republicans look stupid, it's their own actions that does.	republicans 
2325	879771665118449664	'nice parking '	it's a bad parking, the car is outside the line.	bad parking
2326	932688679201488897	interesting contrast ... headline says the markets are dancing on the edge while , at the same time , the dow , s & p , and nasdaq are all up ... maybe they didn 't get the memo ? ! 	headlines contrast with stock status.	headlines contrast with stock status
2327	853828194553610240	'to : <user> you have now brought us to the brink of war ! ! great job ! '	it's a terrible job by <user> to have brought us to the brink of war.	<user>
2328	818105291329904641	oh wow look at the amazing 3g speeds i 'm getting ! 	these are terrible 3g speeds, even a simple google page isn't loading.	slow 3g speeds
2329	846716079082754049	'what a surprise ! '	it's not a surprise, it's expected from the trump administration.	trump administration targeting obamacare
2330	894887949342433280	it 's okay <user> i didn 't want a full latte anyways . great way to start a 12hr shift . 	the author wanted a full latte and he got this partially filled one, it's not a great way to start a 12hr shift.	<user> giving half latte
2331	727624608090722304	'moving is fun . '	moving is a pain, things break.	moving things
2332	899501654810046465	'<user> ji bt plz come via roadroute so that u can know how develop rajastn is  <user> <user> <user>'	<user> ji should come via roadroute so that he can know how undeveloped rajastn is.	rajasthan's roads
2333	710780408527511552	security lines at katl aren 't too bad . 	security lines at katl are bad given the wait times.	delay at the security lines
2334	901607434967539713	'do you remember when you joined twitter ? i do ! this has been on my personal calendar awaiting this day ! # mytwitteranniversary '	this hasn't been on the author's personal calendar awaiting this day since it's not very important.	author remembering twitter anniversary
2335	551646164782815830_463811413	I love chicago traffic #wreck #brakelightsformiles #394	nobody loves chicago traffic.	chicago traffic
2336	709583015987445760	'thanks <user> for all the pepper . i really enjoyed it . really  # gross'	the author is pissed at <user> for too much pepper, he didn't really enjoy it.	<user> putting too much pepper
2337	960969890961003824_1724656252	#sarcastic #skydiving #3am #sleep #follow	obviously people would be asleep at 3am.	person calling at 3 am
2338	815946368195919872	"'# islam is "" still "" the religion of peace '"	islam is clearly not a religion of peace	islam
2339	915883594089975810	'the day is going perfectly '	the day isn't going perfectly, the author needs help.	author needing help
2340	890892964649684994	<user> cracking job with the packing here amazon glad to see you 're doing your bit for the environment 	the box is too big for the package which is a waste, the author is sad to see amazon not doing their bit for the environment.	big box for a small package
2341	819295937487142912	'look out ! mega sale ! '	it's not a sale, the sale price is same as original.	no discount on sale price
2342	755133119469060096	<user> block the site exit , there 's no space on the road , is there ? well done . 	the author is pissed at <user> since they blocked the site exit and there's no space on the road, such inconvenience.	<user> for blocking the exit
2343	877191575067127809	'how to build a team by phil jackson first and final step : try to trade your best players ( melo  kp ) and you got it ! # knicks # nba  emoji_4086 emoji_4086'	trying to trade your best players would ruin your team.	trading best players
2344	752646673348718592	'having a blast with this so far . '	the author isn't having a blast with this since the servers are experiencing issues.	server experiencing issues
2345	898192212097478660	'thank you <user> for selling a new fridge on august 11th with 3/4 of the freon missing and a defective compressor '	the author is pissed at <user> for selling a new fridge on august 11th with 3/4 of the freon missing and a defective compressor.	<user>'s fridge with freon missing and defective compressor
2346	816585639147765760	'oh boy , oh boy , i won !  # scam # spam emoji_929'	this is a scam, a spam mail.	spam mail
2347	839961972007325697	'hmyeah <user>  maybe i _should_ get a second one ?  # adfail # omgitneverends'	the author doesn't agree that phd can open doors since she already has one.	ad promoting phds
2348	910607353963253761	'wow <user> what a bargain ! '	saving just 0.95 isn't a good bargain.	low discount
2349	722169908889591814	'<user> any chance on making the back of your bcaa packaging harder to decifer ? '	the author is pissed at <user> for having such congested back of bcaa packaging which is hard to decifer.	writing in the back of <user>'s bcaa packaging
2350	1113270589953844117_880326447	Fuck, I'm totally glad I'm dumb, fat &  #imanasshole #lmao #imfunnydamnit #sarcasm #funny #funnyshit #totally #glad #fuck #dead #weak #petty #savage #dumb #fat #wasted #college #organic #sober #sarcastic #jokes #iaintright #lol #wtf #carpediem	just because one would die at the end doesn't mean one shouldn't go to college, eat healthy and stay sober.	post saying it doesn't matter what we do as we all will die
2351	938217152422825984	'wow so many options ..... '	there aren't many options in this game.	less number of options
2352	719325574557208576	obliterating a daily rainfall record that 's stood for ~ 50 yrs w / a quarter inch : no problem . # elninoreturns 	obliterating a daily rainfall record that's stood for ~ 50 yrs w / a quarter inch is a problem.	heavy rainfall that broke the record
2353	905588262990962688	it 's good to see all the craziness hasn 't kept fans away from pnc park ! the river walk is so crowded ! 	it's sad to see all the craziness has kept fans away from pnc park, the river walk isn't so crowded.	crowd at river walk
2354	708983417254313984	just love working sunday 's  # snapchat	nobody likes working sunday's.	working Sunday's
2355	931896781214048257	"'this is a perfectly good explanation of why women sometimes appear to be "" irrational "" or "" crazy "" ! # relationships # relationshiphumor # stillsingle # dating # datingadvice # datinghumor # lifeassinglewoman # nevermarried # nevermarryagain # singleat40 # greatrelationships # goodmen '"	"this isn't a perfectly good explanation of why women sometimes appear to be ""irrational"" or ""crazy""."	explanation given by the person
2356	893549988818677763	'so glad we went to automated parking check out in <user> '	the author is sad they went to automated parking check out in <user> because there's so much waiting.	wait at the <user>'s automated parking check out
2357	637953873898070894_345774567	My best friend calls me the nicest things 😂😂😂😂	the author's friend calls him 'ungrateful skank nugget' which isn't nice.	friend's comment
2358	1024416574476586616_23263266	#joke#sarcasm#sarcastic#humour #laugh#wtf#funny#lol#wtf#lmao#hilarious#life#memes#quotes#smile#marriage#wedding#bride#groom#ring#diamond#diamondring#proposal#love#hubby#husband#wife	marriage wouldn't be simple if you have to do whatever your wife wants.	marriage
2359	892945957742096384	'yep , that was grrreat <user> for losing to the <user> that much . we needed that  1/2'	<user> losing to the <user> that much was awful.	<user> for losing to <user>
2360	689871277205671936	'thanks <user> for using plenty of bacon on your bacon cheeseburger '	the author is pissed at <user> for using just a piece of bacon on his bacon cheeseburger.	small amount of bacon
2361	914358546828894208	'found a charging station ! success .. but now internet speed is terrible again . yaaay ! '	the author is sad that he found a charging station but now the internet speed is terrible again.	terrible internet speed
2362	880066537947881473	so glad this show only has girls ! i can 't stand when representation is equal . # forcesofdestiny 	the author's sad that this show doesn't have equal gender representation.	equal gender representation
2363	928705112574451720	'<user> response to <user> written question - efficiency , openness and transparency at its finest  <user>'	the author didn't get a proper answer to the question.	answer to the question
2364	689876038046892032	'love my new <user> z canvas running # windows10 <user> '	the author hates his new <user> z canvas since it gives so many errors running windows 10.	errors in <user> z canvas
2365	828017788539301888	'we need more television shows starring guys with tattoos and unusual facial hair building cars that nobody will drive . '	we don't need more television shows starring guys with tattoos and unusual facial hair building cars that nobody will drive.	car that nobody will drive
2366	911764226238304258	<user> <user> look at this un-patriotic snowflake who 's disrespecting his country and soldiers defending it .  # takeaknee	this snowflake isn't un-patriotic or isn't disrespecting his country and soldiers defending it.	person who's not saluting
2367	865643819454185476	'got tix <num> see this new unknown band . ever heard of them ?  # excited <user> <user> <user>'	the author's got tix to see the rolling stones which is a famous band.	fame of the band
2368	701100477841219588	'<user> way to keep it classy and not at all misogynistic and gross '	the author is pissed at <user> for such classless, misogynistic and gross message of giving free beer to women without shirt.	misogynistic and gross message on the shirt
2369	874531835065356288	'<user> another day of superfast 200mbit / s broadband ! i love getting what i pay for !  # crapservice'	the author is pissed at <user> for such slow internet since he pays for 200 mbps broadband.	<user>'s bad service
2370	824155023869378560	'thanks for the great bargains <user> # discounts '	this isn't a bargain discount, the item is being sold at a higher than original price.	<user>'s discount
2371	861188656110993410	'i am so glad i put the whole day aside to work on my studies on the day that <user> changes my line from 10mb to 0.14 mb  # bleak'	the author is sad that he put the whole day aside to work on his studies on the day that <user> changes his line from 10 mb to 0.14 mb.	<user>'s low internet speed
2372	721240062201974785	'thanks a ton , math class .  # sotrue emoji_332'	the author isn't thankful learning about parallelograms because learning how to do taxes instead would have come in handy in this tax season.	teachings in math class
2373	936289443626942464	'my mother is the most compassionate woman ever . '	the mother isn't a compassionate woman, suggesting to cut the kid's hands off.	mother
2374	885169555986710528	'# globalwarming in antarctica is a scam , just like # trumprussia is a witch hunt ....  # bringbackobama'	global warming in antarctica isn't a scam.	trumprussia and global warming being a scam
2375	847053220371402754	'business meetings . # yey '	business meetings aren't exciting.	business meetings
2376	1013023688301638032_276454507	Love summer time ððð #sarcastic #whatissummer #june #summer #Britain #Britishweather #Leeds #rain #cold #wet #2015 #photograph	the author doesn't like the monsoon time.	rainy weather
2377	901827683503542273	but it 's free to play ! ! ! ! ! ! ! ! ! 	it's not free to play.	game having price
2378	913376085894680576	'adulthood suits me so well  # adulthood # tryingtocope emoji_15 emoji_2461 emoji_3006'	the author doesn't feel adult drinking chocolate shake.	drinking chocolate shake
2379	876608229912064000	'that <user> pizza is look fresh tonight ! '	that <user> pizza doesn't look fresh tonight.	freshness of <user> pizza
