	pid	text	explanation	target_of_sarcasm
716	902892101637111808	'ah ! so i found my parcel <user> obviously lovingly cared for by <user>  # damaged # didntevenknockonthedoor # '	the author found her parcel in a damaged state.	delivery man 
717	878616134907568128	wow ! life changing comment this morning ! * applause * my life will never be the same now , and i 've never heard this before ! 	the author got a terrible comment this morning saying she mutilated herself.	bad comment 
718	892156799717134337	'# tropicalstormemily we will not forget and we will rebuild . '	tropical storm emily isn't serious, just a few drops.	tropical storm being mild
719	914974404186181632	"'<user> thanks for the privacy breach & <user> thanks for the "" resolved ""  wtf happened ? were you hacked ? emoji_75'"	the author is disappointed with <user> for the privacy breach.	<user> for privacy beach
720	930837616240427009	thank you <user> for truly being the voice of the american people . your ( lack of ) compassion , sympathy , and common sense is unparalleled and it 's amazing to think of all the power you have in your tiny , tiny hands . # maga 	<user> isn't truly being the voice of the american people, it's awful to think of all the power <user> has in his hands.	<user> for not caring for american people
721	857031975810605056	pro tip : if you 're a photographer , make your avatar and profile picture one of you behind a camera , taking a pic of us .  # helpful	if you're a photographer, it's not necessary to make your avatar and profile picture one of you behind a camera, taking a pic of us.	having a profile picture of the person behind camera if the person is a photographer
722	687748094427971584	dropped my mac in it 's <user> backpack this morning . lucky their padded bags offered great protection 	the author dropped his mac in it's <user> backpack but their padded bags couldn't protect it from this damage.	<user>'s padded bags as the author's mac was damaged
723	820815585135263744	'always invest in real <num> hour security . lol # sleepingsecurityguard # funny '	such security is useless, the guard is sleeping.	sleeping guard
724	702298789520871424	'gee thanks <user> i can save $ 20 / month to pay an additional three years ! # greatdeal '	it's not a great deal saving $ 20 / month to pay an additional three years.	change in price of the car after three years
725	902497464762200064	'great way to start the first day of school  emoji_156 emoji_2506 emoji_1427 emoji_75'	getting just 3hr 27min of sleep isn't a great way to start the first day of school.	small hrs of sleep
726	836033298002493441	now i 'm no detective but jewish gravestones targeted and destroyed ? doesn 't sound like vandalism . probably just an accident 	it's pure vandalism that jewish gravestones were targeted and destroyed.	destroying jewish gravestones
727	888771514811785216	'when you pick up your <user> online order and your shirt looks like this . outstanding work . '	the author is sad to pick up her <user> online order and find that her shirt looks dirty like this.	<user> online order 
728	892101190867050496	'<user> i subscribed only for # jio2g but in midnight when i traffic will be low am getting # jio3g <user>  # epicfail'	the author subscribed for jio3g and not jio2g.	getting jio3g instead of jio2g
729	880118575368949760	'today i have this glorious view from my hotel window .... '	the view from the author's hotel window isn't glorious.	view from author's hotel
730	1019761062266383744_475692666	Can't get enough of #AprilLudgate and #ParksandRec. #AmyPoehler #NBC #beautifulcontradiction #ironic #thatsgross #iloveit #intern #sarcasmseries #handtype #handlettering #lettering #draw #handdrawn #graphicdesign #type #typography #customtype #design #quote #quotesbyapril #lifeinspiration #dailyinspiration #inspire #funny #sarcastic #goodtype #Morocco #Africa	one doesn't love something gross.	loving something gross
731	853397716432551936	'yes , i ΓÇÖ d like my baby formula with a side of raid roach spray . thank you <user> for making that possible !  # unsolicitedopinion'	it's unusual to have a counter for raid roach spray beside that of a baby formula.	raid roach spray on side with baby formula
732	854176638694772737	'thats all it takes to develop third world countries ? ! why have they been living in squalor all this time ? ! '	that's not all it takes to develop third world countries otherwise they won't have been living in squalor all this time.	person advising to increase the rate at which the national income is saved and invested
733	896202342504202241	<user> your # lte network is so great ... haven 't seen speeds and ping like this since i had <user> . 	<user>'s lte network has terrible speeds.	speed of <user>'s lte network
734	822116641051906052	'the best part about this  is that we are making america great again .  # thanksdonald # aca # obamacare'	this isn't making america great again.	trumps attempt to thwart obamacare
735	912404533594279938	'starting this week off on a positive note  # dinosaur # trex # bookstagram # funny # monday ΓÇô at posman books emoji_107 emoji_3142 emoji_5050'	it's not a positive note that all your friends are dead.	negative note
736	884537614111559680	'thanks a lot <user> . great service ! '	it's not a great service by <user>, people are waiting.	bad service as people are waiting
737	872075583123054593	no ! ! ! i never would 've known if i hadn 't looked at this ! 	these weather warnings are obvious, the author would've known even if he hadn't looked at this.	weather warnings
738	856160724963348481	'woohoo ! what a very productive weekend ! ^ _ ^ i finished several starcraft missions !  # whatthehellamidoing # iwillpayforthissoon emoji_220'	the author didn't have a very productive weekend, he just finished several starcraft missions.	playing starcraft in the weekend
739	839861949777195010	'obviously , we are way behind the curve . '	obviously, usa is way ahead of the curve in defense spending.	usa's high defence spending
740	925172806203080707	'thanks <user> for having such great coverage while the power is out  # fml'	the author is disappointed with <user> for such poor coverage while the power is out.	<user>'s coverage while power is out
741	887751349433139201	wonder if it 's going to rain ? # minnesota 	the forecast says heavy rain in minnesota.	heavy rain 
742	699339916191387648	'wow my heart really aches for your probs  '	kanye doesn't have genuine problems that anyone can relate to.	kanye's trivial problems
743	708039921605353472	shoutout to yukon high school for the great accommodations it 's made for media .  # icantsee	the author doesn't like yukon high school's accomodations since he can't see anything.	yukon high school's accomodations
744	823888723502895110	'it snowed last night !  # sendsnownow # hamont emoji_2665'	it didn't snow last night.	no snow 
745	691174404622008321	"'<user> for the safety of the people please remove the "" eating carpet "" and save lives '"	no one eats carpet.	<user> for believing people eat carpet
746	787572603116462080	'clearly both are above all haters on social media and the prove is when they deactivate their comments on ig .  # partnersoflies'	clearly both are bothered by haters on social media, that's why they deactivate their comments on ig.	both for deactivating their comments
747	704428542579359744	'thanks for the awesome packaging , <user> .  # buyersremorse # thesearechipsnow'	the author is pissed at <user> for such a bad packaging, the taco shells are broken.	bad packaging
748	1023833474246831680_1449452234	Mornings should only consisr of sleeping, sex and bacon. @rebelcircus #rebelcircus #meme #bitchyquotes #funny #bitchy #funnyquotes #sarcasm #sarcastic #sleep #moring #bacon #sex	it's not realistic to expect mornings to consist of just sleeping, sex and bacon.	person who wants only sleep, sex and bacon in the morning
749	923808752318468096	'only haters will say this is not in bhopal . # trendingtrollss # bhopal # unesco # troll   # trending # funny # trendingtrolls emoji_15'	this highway isn't in bhopal, this post is just a troll.	post for showing this highway is in bhopal
750	861955277716824065	i love it here , it 's so much fun watching a number board for hours .  # heathrow # thehorseshoe # trucks	the author hates it there, watching a number board for hours.	watching a number board for hours
751	830552436737769473	'thanks <user> <num> blocking my # driveway its not like ya had the rest of the street open <num> parking  # theyvebeenthereforhours'	the author is pissed at <user> for blocking her driveway, they had the rest of the street for parking as well.	blocking the author's driveway
752	731667126616920064	'they must be paying their employees very well . # raisethewage # fightfor15 '	they are not paying their employees the fair wages	wage of employees
753	702578528546643968	'why , of course ! this campaign needed more agressiveness ! '	this campaign did not need to be more aggressive	aggressive campaign
754	833132920772648960	'# istandwithmarksthiccneck look at all of this productivity going on .... '	they are busy with their mobiles, no productivity going on.	non productivity with phone
755	878187780148314112	'not much this - not a very popular style of beer & not from a very popular brewery .  # piratelife # ipa # mosaicipa'	this is a very popular style of beer & from a very popular brewery.	popular beer
756	698860005269860353	it 's going to be such a lovely day in nyc .  # nycweather # freezing emoji_75 emoji_586	it's not going to be a lovely day in nyc, it's freezing.	cold weather
757	919878340407787520	'good job , malaysians <user>  # ingrates # kufurnikmat'	removing seats from bicycles isn't a good job.	malaysians for removing seats from bicycles
758	862738732256022529	'man these new wireless desk phone headsets are getting fancy . completely wireless . '	these new wireless desk phone headsets aren't completely wireless.	wireless desk phone needing wire
759	920653852457627648	this is probably the most rational thought i 've seen on twitter today ! 	russians posing as average americans isn't a rational thought.	person saying there are russians posing as average americans
760	894324368746086400	'well this is going exceptionally well . # trains '	this isn't going well since the train is 3 hours 34 minutes late.	delay in trains
761	731174148479777065_2731405	What do these things do?! I've never seen anyone use them before!! #comeonpeople	people should make use of indicators.	people who donít make use of indicators
762	855155443068534784	so glad i mobile ordered from <user> and still had a <num> minute wait for my drink . that 's the point of mobile order , right ?  ΓÇô at union station	the author is sad that he mobile ordered from <user> and still had a <num> minute wait for his drink which isn't the point of mobile order.	delay even though mobile ordered
763	849786017871650816	'barry manilow had us all fooled . he never gave us a clue he was gay .  # captobvious'	it's obvious that barry manilow was gay.	barry manilow being gay
764	850123119939506180	'wow . great first experience with <user> <user>  emoji_177'	the author didn't have a great first experience with <user> since the pizza is delivered in a poor condition.	<user>'s bad pizza
765	925138677608611841	isn 't playing vs quest mage just the most fun . :) # hearthstone  ;p	playing vs quest mage isn't the most fun.	playing vs quest mage
766	946156500396814336	did anyone catch this in forbes ? ? ? that 's kind of crazy to think almost half the people in some of these states are in collections . oh , don 't worry , christmas sales were great , we 're doing great ... lol .  emoji_15 emoji_15 emoji_2766	just because christmas sales were great doesn't mean that they are doing great.	people in debt
767	904440215028211712	'truck died in parking lot of feed store ΓÇª good thing it is not hot out here while i wait for my ride . '	truck died in parking lot of feed store, bad thing it is hot out there while the author wait for her ride.	hot weather 
768	889514699896827908	'finally a beer my wife can drink !  seriously what the hell is this # aurosa # nonsense ? # firstbeerfoher # tweeteditedtobesfw'	female can drink any beer, no need for a special beer.	female drinking beer
769	692076080933507072	'<user> <user> nope , definitely no favoritism from <user> about the town hall . '	there is definitely favoritism from <user> about the town hall.	<user>'s favoritism about town hall
770	696859640546463744	woah man .... i sure am loving this june weather we 're having ............  # socalweather emoji_220 emoji_75 emoji_75 emoji_75 emoji_75 emoji_226 emoji_226 emoji_226	the author is hating this very hot june weather they're having.	hot june weather
771	793871157569224704	'awesome . '	it's not awesome that obamacare price hikes vary widely.	obamacare price hikes
772	700802846543876096	'negative interest rates ? sure why not . '	no one would deposit their money in a bank with negative interest rates.	bank's negative interest rates
773	846502680633774080	'well this should fit lots of garbage in it !  # baginabag'	this won't fit much garbage in it, it's a small bag.	size of bag
774	704701368301268994	'boy i love how convenient it is to get to a <user> atm to get money anymore ... only a <num> mile drive  emoji_177'	the author hates how inconvenient it is to get to a <user> atm to get money, have to drive <num> miles.	distance to a <user> atm
775	924332923968544768	'thanks james  i really hadn ΓÇÖ t worked that out for myself '	the author really had worked that out for himself.	james's obvious comment
776	879916326281781249	'my day with <user> keeps getting better ...  <num> flights worth of luggage on the same belt ΓÇô at baltimore / washington international thurgood marshall airport ( bwi )'	the author's day with <user> keeps getting worst since there's <num> flights worth of luggage on the same belt causing inconvenience.	<user> for having many flight's luggages on same belt
777	934778891415277568	'what better way to spend an early sunday off ? # ironing '	ironing is not a good way to spend an early sunday off.	ironing on early Sunday
778	871780633374273539	'and so we wake to another glorious week !  # mondays'	the author isn't excited for another week, another monday.	author's excitement for Monday
779	852754584023965697	'the month of build up for <num> seconds of drama will totally be worth it  # mkr'	the month of build up for <num> seconds of drama won't be worth it.	build up for the drama
780	705645794381017088	'yes . exactly what i wanted to do for 3.5 hours and counting on a weeknight work night . '	the author is frustrated to have to do phone restore for 3.5 hours and more on a weeknight work night.	restoring the phone
781	703067629108359168	hey , i 'm so for # trump2016 .  # dumptrump # sanders2016	the author is against trump.	trump
782	897284396826406913	well , <user> finally did it . i guess that means he 's been wonderful all along ...  # twitler	trump hasn't been wonderful all along.	trump
783	870824733712961537	'this happened earlier so my # dateline tweets might be off the hook tonight . # wine # beach # drinks '	the author drank wine earlier so his dateline tweets might not be off the hook tonight.	author drinking wine
784	841281965462556672	'# uncletex & # bigminpig shunning us ! gee i wonder why ... '	bigminpig is shunning the author since she is having bacon.	author having bacon
785	695312175066435585	'never seen a # dlr train driver before . looks like a tough job  # london'	dlr train driver's job looks so easy, just have to press a few buttons	dlr train driver's job
786	861778185415008256	'this is going to age sooooooo well . '	this is not going to age well	collusion of russia and trump 
787	915560914711142400	omg ! i 'm second row from the front ! check out my amazing view .  ;)	the author is second row from the front but to the side so she doesn't have a good view.	author's view
788	859052074859941889	'50 minutes delay ! gysev , i love ya ...  # traindelay # imfreezing # backtosalzburg'	the author hates that the train is 50 minutes delayed.	delayed train
789	891351748916498436	'i ΓÇÖ m just so relieved we have a <user> that will deal with north korea in a level-headed manner ! '	the author is worried about the violence since they have a <user> that will deal with north korea in a level-headed manner.	<user>'s level headedness
790	883101074831400960	woohoo ! thank you niantic for ash hat pikachu that 's not anywhere on my nearby . i 'm so happy  # pokemongo	the author is sad that ash hat pikachu isn't anywhere on his nearby.	absence of ash hat pikachu
791	873667494745182208	thanks <user> , that 's really really great .  # netflix # oitnb # error	the author is pissed at <user> for such an error.	<user>'s error
792	720022773536415745	'<user> great support effort on twitter ! '	<user> isn't putting much support effort on twitter, just responding with the same message to everyone.	<user>'s bad support effort
793	820400898702589952	'<user> because making light of drug use during an # opioidepidemic is always great marketing .  # addiction # heroin # mentalhealth'	making light of drug use during an opioidepidemic is the worst marketing ever.	<user> making light of drug use
794	817487630258597891	'my days going great !  . emoji_107'	there's snow on author's car seat, her day's not going great.	snow on author's car seat
795	919904145238245377	'whoever is in charge <user> for online ticket booking , thank you <num> testing our patience for d lst 18hrs or so <user>  # fail'	the author is pissed at whoever is in charge for online ticket booking for testing their patience for the last 18hrs or so.	<user>'s online ticket booking
796	698023639136862208	hmmm ... i can 't spot the difference .  # redraw	the author has significantly improved her drawing compared to the last attempt.	difference between two drawings
797	886300737831043072	'current temps . another great phone forecast from earlier in the week . '	given the current temps, the phone forecast from earlier in the week isn't great.	phone forecast 
798	1016783430017067620_1642472793	I love these summers: the sun, the warmth... #sarcastic #badweather #rain #rainyday #cloudysky #sky #nature #naturelovers #natura #pioggia #cielo #sera #evening #summer #hamlet #borgodour	the author hates this bad weather which isn't summer.	bad rainy weather
799	877736113154146308	'<user> how do i phase through attack midair like the l7 ai ?  # arms # nintendoswitch'	it's unfair that the author can't phase through attack midair like the l7 ai.	i7 ai for attacking midair
800	720172483379347457	that 's what i call quality control .  . # hp # proliant # dl360 # server	The quality of this dl360 server is pathetic	dl360 server's quality
801	888511436317642752	'seats are just turrible  emoji_15 emoji_15 emoji_15 emoji_15 emoji_15'	seats aren't turrible.	seats in the stadium
802	761102593644834816	'you sound like # kishorekumar whenever you lip-sync !  # absidisms'	you don't sound like kishore kumar, it's just a lip-sync.	person who sounds like kishorekumar
803	709026575552008193	'yeah , this guy should be president !  # hitler2016'	the author doesn't want donald trump to be president.	trump
804	871808225708044288	finally , a convenient solution to party chat in video games ! ! ! why didn 't sony & microsoft do this years ago ?  # nintendoswitch # lol	it's not a convenient solution to party chat in video games, that's why sony & microsoft didn't do this years ago.	solution to party chat
805	859435527451357184	'. <user> good job ! '	trump hasn't completed anything from his 100 day plan, bad job.	trump not completing 100 day plan
806	899562132026658818	work who needs it - let 's rob a bank ?  let 's getaway # rhetorical not <num> rhyme is a crime - sounds like grime	everyone needs work.	needing work
807	877519144123588609	'sooooo nice of the city to help yanez transition off of the force into a new line of work . that poor man . '	it's not nice of the city to kick out yanez from the force into a new line of work.	city for kicking yanez from the force
808	870819477218181120	'thank you sugar information , inc . !  # sugarstupidity'	it's obvious information, nothing new.	obvious information
809	893216146165575683	'definitely my favourite .  # writerslife # writing # writer'	no author likes writing a synopsis.	author writing synopsis
810	924990099997253633	'304 days is needed to have a family doctor ! what a wonderful health care system we have in quebec ! # healthcaresystem # quebec '	if 304 days are needed to have a family doctor, it's not a wonderful health care system.	health care system in quebec
811	898183640806551553	'john kelly has really done a great job of bringing order to the white house .  # charlottesville'	john kelly hasn't really done a great job of bringing order to the white house.	job done by john kelly
812	862391626240413696	that 's odd , i wonder why nobody cycles to silverdale ?  could it be that our highway doesn 't have cycleways ?	it's obvious that nobody cycles to silverdale because the highway doesn't have cycleways.	no cycleways in highways
813	859649235184214018	'that was nice of them .... i bet she was thrilled ! !  emoji_1594 emoji_1930 emoji_2894'	the woman won't be thrilled to be awarded the guinness record title for the highest fall without a parachute at 33000 feet since it's tragic.	guisness record title
814	922919295364997120	'awesome <user> ( ? ) just followed me ... wow thought he ΓÇÖ d have more than <num> followers  ... real frankie please follow :) emoji_15 emoji_15 emoji_15'	the author isn't excited that <user> followed him since it's a fake account.	fake account
815	889071101677981697	let 's applaud for prevailing # sexism in tamil cinema and generally in the lives of women around the world . 	prevailing sexism in tamil cinema and generally in the lives of women around the world should be condemned.	sexism in tamil cinema and around the world
816	899691934507311104	'an amazing view of the # eclipse2017 in lansing , michigan .  # puremichigan'	this isn't a view of the eclipse2017 in lansing, michigan.	no view of eclipse in michigan
817	864616491563585537	'bad obama . bad . terrible . sad . '	obama shouldn't be criticized for a trivial thing like chewing gum.	obama chewing gum
818	830233270164000768	good job  james dolan . kick out someone who 's the fabric of one of the best eras of # nyknicks basketball . # charlesoakley  # knicks	it's a bad job by james dolan to kick out someone who's the fabric of one of the best eras of nyknicks.	james dolan kicking out a good player
819	894011874609594370	i 'm so glad <user> is out of ice and sweet tea and almost put some toppings on my quarter pounder .  # fail ΓÇô at mcdonald 's	the author is so sad that <user> is out of ice and sweet tea and almost put some toppings on his quarter pounder.	<user> not having ice and sweet tea and less number of toppings
820	817839142826627072	'going <user> ? avoid the steak burger that comes looking like this all for the worthy price of ┬ú 10.60 ! # bargain  # wasteofmoney'	the steak burger at <user> isn't worthy of price since it comes looking like this.	<user>'s steak burger 
821	849200490994860032	'obviously im pretty thrilled about it raining non stop until wednesday morning ... # newenglandweather # springtime # apparently '	the author is annoyed about it raining non stop until wednesday morning.	raining non stop
822	937787096768671744	'what a lame job i have ...  <user> # dolphins <user>'	the author's job isn't lame.	<user>'s cool job
823	871706375256236033	<user> i just love dealing with the previous night 's stupidity  # warrenvalleygolf	the author hates dealing with the previous night's stupidity, there's a car stuck in the bushes.	<user>'s stupidity previous night
824	684667398843047936	'/ / me and my mentions right now hahaha '	one needs messages in order for one to answer them.	no messages for the author
825	852489556410630144	hundreds camped out last night , and this is the line this morning for star wars celebration . doesn 't seem busy .  # swco	hundreds camped out last night, and this is the line this morning for star wars celebration, it does seem busy.	huge crowd for star wars celebration
826	822849151759253504	'look at these radical , anarchist protest signs .  # womensmarch # chicago'	the sign of equality for everyone isn't radical or anarchist.	sign of equality
827	852707933104218116	'i can draw ~ '	it's a doodle and not a drawing.	bad drawing
828	728695864772857856	'very impressed that i pay <user> $ 11 each morning to have my car broken into 2x in <num> months . '	the author is pissed at <user> that she pays $ 11 each morning and still has her car broken into 2x in <num> months.	<user> for not servicing the car properly
829	851895094399598593	let 's charge more and have less trains . good idea ! that hasn 't even started and there are still weekly delays on <user> # redline 	looking at these crowd, it's not a good idea to charge more and have less trains.	<user> for weekly delays
830	853859121694724096	'is this mr . <user> was talking about . smith is slight better than msd .  # msdhoni'	mr. <user> was talking about this comparison but msd is better than smith.	comparision between dhoni and smith
831	844498284139851776	'bogor green city # satire '	a city doesn't become green city just by having green coloured cars and clothes.	green city having cars and bikes 
832	938716060576047105	'<user> <user> nothing says fun like getting ready for a raid at 5:30 in the morning . '	it's not fun getting ready for a raid at 5:30 in the morning.	raid at 5:30 in the morning
