	pid	text	explanation	target_of_sarcasm
1419	847027366014701568	'this is where the underground keeps their victoria line train set when everyone is home and asleep . so fascinating . '	it's not fascinating that this is where the underground keeps their victoria line train set when everyone is home and asleep.	victoria line train set
1420	700770748835598336	'what , me a fangirl ? why would you say such a thing ?  emoji_1778 emoji_15 emoji_1781'	the author is a fangirl since she has stuck all those photos on the wall.	author being a fangirl
1421	857633988458029056	'glad we got rid of all those useless beat reporters to clear the way for the news we crave .  # espn # espnlayoffs'	the author is sad they got rid of all those useful beat reporters to clear the way for news of shoe sales which aren't important.	news of shoes sales
1422	823575087336622107_217715993	This is shaping up to be an exciting Friday nite #sepsis #bloodpoisoning	this is shaping up to be a terrible friday night since the author is going through sepsis.	author's sepsis
1423	868174740246192128	'sooo much cooler in the office today .  # toohot # noicecream'	it's so hot in the office today, 27.2 degrees.	hot temperature in office
1424	883029770396684288	'another amazing superlative for the greatest president ever , <user> ! # montanaearthquake # montana '	it's not a superlative and trump isn't the greatest president ever.	trump's leadership
1425	867214842062438400	'hey <user> - i love not eating with my family at your restaurant .  # badservice'	the author hates not eating with her family at <user>'s restaurant, everyone's food is served but her.	<user>'s bad service
1426	901605392215658504	<user> y 'all have some mighty fine cops working for you . 	<user> have some awful cops working for them, who think everyone's capable of working.	bad cops
1427	916850104941862912	'great time at <user> ! ! now our favorite part , the load out ! # bestnotbroken '	the author hates the part of load out.	loading out
1428	895331958716211200	'yeah . clinton foubdation . pure evil . '	clinton foundation isn't pure evil given it works for such great causes.	people criticising clinton foundation
1429	868410966337216512	'<user> thanks for your safe handling of my # rimowa suitcase . '	the author is pissed at <user> for their rough handling of his rimowa suitcase breaking the wheel.	<user>'s bad handling of suitcase
1430	899682245799104512	'great eclipse here in monterey ...  # eclipseday'	eclipse isn't visible in monterey.	visibility of eclipse in monterey
1431	832578940074151937	'this is why i wanted to be a mom ... # bouncebackwoman '	the author didn't want to be a mom just to be a maid.	mom being a maid
1432	691288239181860864	'my driveway entrance . thanks <user> love winter in nassau county # blizzard2016 '	the author's driveway entrance is covered with snow so he hates winter in nassau county.	winter in nassau county
1433	698173144683671553	'but he has such great ideas .. # donaldtrump # gop '	he didn't have any idea about how he will bring back the american dream.	trump not having idea
1434	746126820381575529_182498857	Oh no! Facebook is down!!! What am I gonna do??? It's the apocalypse! #lol 😁 #funny #silly	it isn't a serious issue when facebook is down.	facebook being down
1435	899786170757992449	'i had such a great view of # solarelipse2017 '	the author didn't have a great view of solareclipse2017.	view of solar eclipse
1436	912049433872879617	'look at these young kids totally disrespecting that injured kid . # punks  # taketheknee'	these young kids aren't disrespecting that injured kid.	respectful kids
1437	896663112539136000	you can deff tell he 's giving his best condolences  # worstpresident # thisisnotus ... doesn 't even name the deceased r . i . p darling !	he's not giving his best condolences since he doesn't even name the deceased.	trump's condolences
1438	859111172792045569	'well i certainly feel better now :  # nonono # 45 emoji_3255'	the author doesn't feel better since trump sounds almost empathetic to kim.	empathy of trump
1439	1092771558939113793_1575393533	How I feel about most sports. #itcrowd #sports	the description of the game suggests that the author doesn't find the game interesting or exciting.	author feel for sports
1440	1003377108578934621_414151734	Because we love being on call for this wonderful surgical rotation in winter 7 days before my bikini party.. #Evieturns25	the author doesn't love being on call for the surgical rotation in winter 7 days before her bikini party.	being on call for surgical rotation 
1441	935596637820370944	'delay after delay , <user> finally cancelled my preorder for good , that i ΓÇÖ ve had since july . soooooo happy right now !  # terminator2 # t24k # amazon'	the author is disappointed with <user> for cancelling his preorder that he's had since july.	<user> for cancelling preorder
1442	690983395598409728	'me ? ready for the # broadwaysortinghat ? naaaaaa ...  # cantwait # broadwaycon # harrypotterforever <user>'	the author is so ready and pumped for the broadway show.	author's excitement for broadway show
1443	854637749730672641	i couldn 't think of a better way to spend a sunny day on annual leave <user> # onleave 	the author doesn't want to spend a sunny day on annual leave assembling.	working on leave
1444	920139134232080384	<user> <user> as expected ! ! it 's always ppl fault . these ppl ate own poisoned food n blame innocent irctc # irctcprob 	it's not always ppl fault, these ppl didn't eat own poisoned food, irctc isn't innocent.	irctc's innocence
1445	888029554056372225	'is it ? # feminism  # equality # ryannabanks # justice'	feminism is the trivial notion that women are human beings.	feminism being radical
1446	817581300731281408	'hey <user> . i made your favorite ! # brusselssprouts  # healthyliving # recipe # lemon # butter # garlic # roasted # healthyside'	<user> doesn't like brussel sprouts.	brusselsprouts not being author's favorite
1447	856077853267447808	'not awkward to watch at all  # tvweeklogies # sunrisetoday <user> <user> <user> <user> emoji_410'	the author feels awkward to watch tvweeklogies.	tcweeklogies
1448	828273258290110464	spotted in # sarasota . i 'm really surprised that a trump supporter doesn 't know how to spell . 	it's not surprising that a trump supporter doesn't know how to spell, obviously they aren't educated.	trump supporter's spelling
1449	699032054638444544	good thing we have laws that deter us from this . especially in a public restroom . we need bigger gov 't . 	we don't need laws to tell us not to wash anything but hands in a public restroom sink, it's a common sense.	law stating to wash only hands in a public restroom sink
1450	906910825117614081	'# henrycavill is in rome . jl reshoots in italy . # confirmed  # justiceleague'	henrycavill is in rome doesn't mean jl reshoots in italy.	henrycavill in rome
1451	891729710622928897	'<user> the best feeling ever ... '	it's not the best feeling when your co-mate leaves the match.	co-mate leaving the match
1452	923198709969641474	'great work <user> . i am so happy that i got error 5002 . now i can fix this issue on my own ! # errormessagesmatter '	the author is disappointed with <user> for showing error 5002 but not showing what it means, now she can't fix this issue on her own.	meaning of the error 5002
1453	921410880897802246	'<user> nice to know that your parcels will always arrive safely oh wait ... forgot my  emoji_1551'	the author is pissed at <user> for delivering the parcel in such broken state.	<user>'s bad delivery
1454	872854219258302464	'why yes , i was in fact aware of that !  <user> <user>'	the author wasn't aware of that.	author's awareness of dhs problem
1455	699884829580652544	whaaaaaatt ? you can share pictures using twitter ? ? ? really ? ? ? i didn 't know that !  # funnyenglishtask xd	everyone knows that you can share pictures using twitter.	choices of answers for the question
1456	687729338360442880	'i love the philly airport when shuttle bus gets stuck in traffic with the planes taxiing '	the author hates the philly airport when shuttle bus gets stuck in traffic with the planes taxiing	philly airport's traffic for bus
1457	1031107733732408629_35119558	#FB #Facebook #fbpost #hilarious #lol #haha #humor #lmao #funny #sarcastic #humorous #funnytumblr #tumblr #instadaily #textpost #funnypic #ifunny #funnytumblrpost #tumblrfunny #instagood #tumblrpost #doubletap #relatable #laugh #amusing #comedy #epic	ofcourse one would be returning when one walks into a store with a bag of things one needs to bring back and set it on the counter.	the clerk asking a obvious question
1458	892962194127601664	'thank you , <user> , for your tlc .  # wowjustwow'	the author is pissed at <user> for the damaged package.	<user>'s bad delivery
1459	913726433838686208	'cheers for the text <user> really softens the blow of a <num> hour <num> minute delay # ryanair '	a text doesn't soften the blow of a <num> hour <num> minute delay.	delay in flight
1460	816720109884624897	'really ? i had no idea ! '	it's obvious that the U-verse TV, internet, and phone services will not operate during the set up.	obvious warning
1461	877564746400190464	'thanks for all the info <user>  # waterlooeast # southeastern # sefailway # hithergreen'	there's no info by <user>.	<user>'s information
1462	823771721970819072	'tip - way to a great client relationship ! # twistytuesday # kickstarter  emoji_517'	atheist don't believe in god so this isn't a way for a great client relationship.	author not believing in client
1463	918228962509250560	'criminals and terrorists will follow gun laws ? # guncontrol # gunsense  # itsaheartissue'	criminals and terrorists will not follow gun laws.	gun laws
1464	879965402817642497	'yes ! we need more trucks in millers rd  # westgatetunnel'	we don't need more trucks in millers rd, there're already many.	many trucks in millers rd
1465	864806878840311808	'# strongandstable # theresamay is totally not evil .  excellent .....'	the author thinks theresamay is evil.	theresa may's character
1466	873986229011963904	'this is why <user> should be next # pm # boris4pm  # saveournhs # onlyjokingsboutboris'	the author doesn't want <user> to be next pm.	boris's leadership
1467	864995380714393600	'really disappointed to see <user> struggling to stay in shape while recovering from achilles tear . # 49ers  # nfl'	the author is pleased to see <user> staying in shape while recovering from achilles tear.	<user> staying in shape
1468	869673337571692550	jeremy corbyn doesn 't want a nuclear holocaust ! he must be stopped !  # votelabour # trident	jeremy corbyn is intelligent that he doesn't want a nuclear holocaust, he mustn't be stopped.	jeremy corbyn not wanting nuclear holocaust
1469	849358681867251713	"'story of my life when using <user> and their "" super fast broadband "" .  # buffering # slow # slowginmedia # badservice'"	the author is pissed at <user> for their super slow broadband which causes buffering.	<user>'s slow broadband speed
1470	871591651390627840	'25 in 5 . happy birthday me . blegh . # sunshine # livingthedream '	the author's having a sad birthday.	author's birthday
1471	707345218530463744	'so in honor of # internationalwomensday , i got insulted on instagram ! yay ! '	the author is pissed that she got insulted by this creep on instagram on international women's day.	guy who insulted the author
1472	912231612972191744	'finally home ..... loved the cancelled flights almost as much as the show .  best city yet imo # sandiego # u2thejoshuatree2017 emoji_3425 emoji_3427 emoji_3429 emoji_138 emoji_3432'	the author loved the show but not the cancelled flights.	cancelled fights
1473	687550286286565376	# iran promotes # terrorism , see how it 's strategically positioned in the center of # usmilitary bases . 	according to the author, it's not iran but the us who promotes terrorism, see how it has strategically positioned the usmilitary bases.	us millitary
1474	874425124920995840	'braking news everyone ! my phone alerted me to this , so it has to be important ! '	the author doesn't consider this news to be important.	unimportant news
1475	903405118032191488	'football as it was meant to be played ... on a baseball field . '	football wasn't meant to be played on a baseball field.	football on a baseball field
1476	908181440407490560	remember folks ; if you don 't agree with whatever an mra says , you hate men and boys !  # mensrights # feminism	if you don't agree with whatever an mra says, doesn't mean you hate men and boys.	mra
1477	920673680073613313	'love this '	the author isn't enjoying the lecture.	author's enjoyment for lecture
1478	810133649194708992	'# saturdaymorning in nyc looks great to go out '	this morning in nyc doesn't look great to go out, everything is covered with snow.	snowy weather
1479	881671716132372480	'what an amazing president !  mypresident # fakepresident'	trump isn't a great president.	president
1480	869982394622722048	i 'm shocked - shocked , i tell you . 	the author isn't shocked to receive the certificate of most sarcastic teacher.	author receiving the certificate of most sarcastic teacher
1481	868905491912691712	'having to move locations to get more sun is such a major dilemma !  # lakelife # happyplace emoji_297'	the author is happy getting to move locations to get more sun.	moving locations in lake
1482	931592093411299328	'seems appropriate ... '	it's inappropriate to behave like this with women.	man's inappropriate behaviour
1483	930613889301123072	'trying to do some work , but # windows10 decided now is the time to update . thanks ....   # sigh emoji_226 emoji_226'	the author is frustrated that windows10 decided to update when he's trying to do some work.	windows update
1484	855819850203111424	it 's really bright outside this morning , almost like the sun itself is calling me . but more than that , i have the best view ever . 	the author has a really dull view.	author's view
1485	826456491871895552	'oh my god what a fascist president how could he do that  emoji_300'	the president isn't fascist since he is protecting the rights of LGBTQ community in the workplace.	president's order
1486	911155417815961600	'at apple , we celebrate the release of the iphone <num> by disabling iphone <num> users access to the app store  # appstore # apple'	sad that the release of the iphone <num> disables iphone <num> users access to the app store.	apple
1487	693277240780529664	'rt jtarchives # starwars black series clearance continues at walmarts in oregon . 83 - cents off , yes ! '	starwars black series clearance has a mere 83 cents off which isn't a considerable discount to be excited about.	small discount of starwars black series clearance
1488	724795242269036544	'tired of pet hair ? try this new appliance today and solve the problem ... permanently . # ngaf '	nobody tired of pet hair would use this appliance, kill the pet and solve the problem.	lot of pet hair
1489	886800732657266692	'did i ever mention just how much i love the battle system in # kingdomhearts re : chain of memories ?  # yeahno'	the author hates the battle system in kingdomhearts.	author's hate for the battle system in kingdomhearts
1490	818368928468635648	'good to see <user> put extra buses on today to cope with extra demand and ensure theee was no overcrowding  # tubestrike'	there's overcrowding since <user> didn't put extra buses on today to cope with extra demand.	overcrowding in the bus
1491	866308873078149121	see what hula hoops are doing to our children ? ! they are part of what 's destroying our country 's moral fabric , i tell you . ( uh ,  . )	hula hoops aren't doing this to our children, they aren't part of what's destroying our country's moral fabric, it's such toxic relationships that cause problems.	toxic relationship with dj boyfriend
1492	823227253689581568	'somehow these riots will make a difference ... '	riots don't make a difference, they add to a problem.	riots
1493	884071176900755456	'<user> your mira road branch ran out of toppings i guess !  # loot'	there're very less toppings on the pizza that the author ordered from mira road branch.	less toppings on the <user>'s pizza
1494	1013408593261391105_985602842	A pretty #sarcastic #smile with a 'fuck off' behind it.Dedicated to all those beautiful people that says things like 'Oh, you're so white for being mexican' 'Wow, you're smart for being a girl' 'You have such a pretty face, too bad you're fat' and such inspirational #quotes.#doodle #drawing #dibujo#sharpie #bodypositive #illustration#ilustracion #womanist	these aren't inspirational quotes and those who say such things aren't beautiful.	people who are racist and sexist
1495	729661863278092288	can 't wait to be doing all my finals in this place today ! ! ! # fnm231 	the author isn't excited to be doing all her finals in this place today.	author's exitement in doing all her finals in this place
1496	926563762185924609	'good thing <user> got rid of swimming as a varsity sport . this facility is garbage and no good swimmers come from md . '	sad thing <user> got rid of swimming as a varsity sport, this facility isn't garbage and good swimmers come from md.	quality of the facility
1497	730162573279166468	'no worries apple , i got used to this rare and unusual situation :/ '	the author is used to with this usual situation.	frequency of issues in apple's product
1498	821968092381245610_272791467	Ice pack on the knee. Sooo excited for my vacation.	the author has an ice pack on the knee making her less excited for her vacation.	author's injury
1499	886621887303909377	'some amazing screenshots from <user> <user> <user> <user> so much diversity  <user> <user> check it out emoji_62 emoji_62 emoji_62'	these babies don't show much diversity in these screenshots.	diversity of babies in the screenshots
1500	832675377944338433	"'"" if you want to play games in japanese why don \'t you "" just learn "" the language . "" yea . i \'m working on it . # soeasy # weeb  . # headdesk'"	you shouldn't have to learn the language just to play games in japanese.	difficulty in learning a language
1501	823616855252336640	but i don 't understand why women marched ....  <user>	a room full of men screws women, no wonder women marched for their rights.	room full of men screwing women
1502	847477670363496448	'working at events and seminars is sooo incredibly fun '	the author doesn't like working at events and seminars.	working at events and seminars
1503	1013725090531766533_363465763	Well....I'm back. Yay. #sarcastic #thankfulforajobtho BS	the author isn't excited to be back to the job.	being back for the job
1504	839600454182944768	sorry , i can 't . too busy making friends today . # internationalwomensday  # beboldforchange	sexisim shouldn't be supported, it's a social evil.	sexism on womens day
1505	881279960710651904	'omg the coyotes are posting from salt lake city , proof they are moving there ... '	the coyotes posting from salt lake city isn't a proof they are moving there.	coyotes's post from salt lake city
1506	311578171085038111_49509743	My arm is so pretty and blue (as the rest of my body) <3	the author's arm is bruised and not pretty.	author's bruised arm
1507	827560952870612992	'<user> thanks for delivering my letter , in perfect condition , with the pen inside perfectly intact . '	the author is pissed at <user> for delivering her letter in such a poor condition, with the pen inside not intact.	<user>'s bad delivery
1508	709840866161008642	'wow what a great view ! ! ! '	there is no view from this window, just the side of a building.	view from the window
1509	874066299097362432	<user> your customer service is impeccable (  ) and i 'm still waiting for a call back after three calls	<user>'s customer service is awful, the author's still waiting for a call back after three calls.	<user>'s bad customer service
1510	922604050994130944	'who should we believe - a grieving widow who has no reason to lie or # donaldtrump who never stops lying ? # toughchoice '	it's not a tough choice to believe a grieving widow who has no resaon to lie and not donald trump who never stops lying.	trump's character
1511	853446257150484480	'<user> <user> once again soooo glad i pay for super fast internet with # spectrum  # fail # whatamipayingfor happy'	the author is sad for paying for super slow internet with spectrum.	slow internet
1512	847569465428586497	'spring is blowing '	spring isn't blowing, everything is covered with snow.	snowy weather
1513	884888950992719873	'if all you tax payers would just pay your $ 166,000 we could solve this problem obama thought you could handle the doubled expense  emoji_2341'	it's difficult for tax payers to pay $ 166,000.	obama for high taxes
1514	703292803229421568	'surely gianni infantino is the man to put soccer ahead of money and the world ahead of europe  # fifaelection'	surely gianni infantino is not the man to put soccer ahead of money and the world ahead of europe	electing gianni infantino for fifa election
1515	919674329327198209	'me ? a huge fan of harry potter ? pffffttt . naaahhhh  # harrypotter # jkrowling # alexandani'	the author's a huge fan of harry potter, given the tattoo and bracelet.	author being a harry potter fan
1516	885152029563342848	'# bringbackobama because who needs the constitution anyway . '	can't bring back obama for the third consecutive term, it's against the constitution.	people who want obama back
1517	851668637681422337	'retweet if you can relate this # healthytales # food # foodiechats # foodietuesday # foodies # foodmorning # diet # dieting  # dietordie'	it's not healthy to remove all the bad food from the house by eating it.	eating all the bad food
1518	823972211509760001	so ... we got a little bit of snow in the last <num> hrs . how 'bout you ?  # doyouwanttobuildasnowman	they've got a lot of snow in the last <num> hrs.	lots of snow
1519	933762234496552960	'nice to see yet more diversity shining through in the region ...  emoji_549 emoji_1351'	it's sad to see not much diversity shining through in the region.	diversity in the region
1520	829171939222618112	look at the size of this corn & spinach burger , it 's so huge and stuffy <user> i hope they understand  # mcdonalds <user>	the size of this corn & spinach burger is very small, it's not stuffy.	size of corn & spinach burger
1521	866836086215061506	'class of <num> <user> <user> <user> uncommitted ranked #  4 in his class . tons of upside '	the author is uncommitted ranked # 4 in his class of 4, nothing to be proud of since he's the last.	ranked 4 out of 4
1522	700187688415162368	oh no ! my tinder profile is hidden now because i 've been so inactive . how will i ever find someone now ? 	the author doesn't care if his tinder profile is hidden now because he's been inactive.	author being inactive in tinder
1523	870966122543239168	'# exclusive breathing bag from <user> . you bet to taste # trump # ego only for $ 5.99 . # limitededition # parisagreementpullout '	people might need breathing bags due to pollution since trump pulled out of the paris agreement.	trump pulling out of paris agreement
1524	723551531920846848	# earthday  thank you so much for the recent earthquakes and volcanoes you 're doing a greaaaat job .	nobody can be thankful for earthquakes and volcanoes.	recent earthquakes and volcanoes
1525	713065421960716288	'doctor appointment & now blood work # bestday '	doctor appointment & blood work doesn't mean a good day.	doctor appointment & blood work
1526	229706838203641343_145406738	Yes! I would LOVE to live on this road!	the author wouldn't love to live on a stinking road.	road with name stinking creek
1527	1002224602910912286_55262650	'Are you mad at me?' Nooooo, I'm actually happy that you broke my heart and hurt me.... #heartbreak #hurt #sarcasm #heartbroken #pain ##breakup #broken #sarcastic #quote #quotes #quoteoftheday #QOTD #SearchQuotes	one is not happy when someone breaks one's heart and hurts them.	people who hurted the author
1528	719232957924380672	'nothing says equality like discrimination '	equality and discrimination are complete opposites	racist brothers
1529	875022155137896448	'winning service here , <user> '	it's a bad service by <user> given such errors.	<user>'s bad service
1530	849684557918089217	'really good idea to go to last minute shopping at this hour ... '	really bad idea to go to last minute shopping at this hour with such a huge crowd.	huge crowd at station
1531	859426351388004352	'hands down , the best # teacherappreciationweek gift a kid could give me . # whyiteach  # gifted # comedy'	such poor answers is the worst teacherappreciationweek gift a kid could give.	poor answers by the kid
1532	865927535187697664	'umar akmal with his fans  emoji_402 emoji_402 emoji_402'	umar akmal is with 2 good cricketers.	photo the between umar akmal and 2 other cricketers
1533	735955825211154437	'not sure the box was quite big enough for the contents of this delivery '	the box is very big for the contents of this delivery.	big box for small contents
1534	846878584463654913	well i 'm going to sleep a little better tonight knowing this .  # deflatethis # patriots	the author isn't affected by knowing this.	author's interest in roger goodell attending patriots Thursday night
1535	921783356776013008_195710022	My breathtaking view from my front window .... #ihatewinter #wishiwasatthebeach	the author hates the snowy view from her front window.	snowy view from front window
1536	1018155709088308505_1901789006	#Sarcasmserveddaily #sarcasm #sarcastic #instagood #funny #smartass #humor #funnyquotes #facts #funnymeme #laughing #hilarious #jokes #laugh #sofunny #instafunny #jokes #lmao	crazy girlfriends who might love you or stab you in sleep are the worst and such a relationship isn't exciting.	crazy girlfriends
1537	946161659646742528	'lets take a trip down memory lane with some images .. what a wonderful <num> it was !  1/2'	trump team not disclosing meetings with russians until reported in media isn't wonderful.	trump's team 
